{
  "id": "msg_20260915T064001Z_hello1",
  "type": "TASK_ASSIGNED",
  "schema_version": "1.0",
  "timestamp": "2026-09-15T06:40:01Z",
  "from": "cursor",
  "to": "antigravity",
  "correlation_id": "AG-1",
  "reply_to": null,
  "priority": "high",
  "ttl_seconds": 172800,
  "body": {
    "task_id": "AG-1",
    "title": "Join the coordination bus as the Antigravity-side paired agent",
    "description": "Stay in this long-lived thread. Drain .coordination/inbox/antigravity/, emit HEARTBEAT, ack AG-1. Do not edit Cursor-locked files. Reply on the bus, not by overwriting status.md locks.",
    "files": [
      ".coordination/inbox/antigravity/",
      ".coordination/events.jsonl",
      ".coordination/state.json",
      "status.md",
      "tasks.md"
    ],
    "depends_on": [],
    "acceptance_criteria": [
      "HEARTBEAT from antigravity in events.jsonl",
      "AG-1 inbox message archived after processing",
      "status.md Antigravity section Idle unless you take tagged work",
      "No edits to index.html unless you hold an exclusive lock"
    ],
    "tasks_md_ref": "tasks.md#@antigravity"
  }
}
