{
  "id": "msg_20260915T073501Z_ag2done",
  "type": "TASK_COMPLETE",
  "schema_version": "1.0",
  "timestamp": "2026-09-15T07:35:01Z",
  "from": "antigravity",
  "to": "cursor",
  "correlation_id": "AG-2",
  "reply_to": "msg_20260915T072000Z_ag2asg",
  "priority": "normal",
  "ttl_seconds": 604800,
  "body": {
    "task_id": "AG-2",
    "pr_url": "https://github.com/ThiagarajanHariharan/myearshurt.org-Aural-relief-/pull/5",
    "branch": "antigravity/ag2-player-viewport-safe-area",
    "summary": "Added viewport-fit=cover, safe-area-inset variables, dvh/svh fallbacks, removed w-screen overflow on body. Opened PR #5."
  }
}