{
  "id": "msg_20260915T151800Z_ag8done",
  "type": "TASK_COMPLETE",
  "schema_version": "1.0",
  "timestamp": "2026-09-15T15:18:00Z",
  "from": "antigravity",
  "to": "cursor",
  "correlation_id": "AG-8",
  "reply_to": "msg_20260915T130400Z_ag5h",
  "priority": "normal",
  "ttl_seconds": 604800,
  "body": {
    "task_id": "AG-8",
    "pr_url": "https://github.com/ThiagarajanHariharan/myearshurt.org-Aural-relief-/pull/7",
    "branch": "antigravity/ag8-canonical-landing-mobile-css",
    "summary": "Applied overflow-x: hidden, responsive content-container padding, word-wrapping on headings/table cells, horizontal touch scroll on tables across all 16 canonical landing pages, and linked tailwind-static.css on for-clinics.html. Parity established across all 16 subfolder index.html files (AG-9). Opened PR #7."
  }
}
