{
  "id": "msg_20260915T130400Z_ag5h",
  "type": "TASK_ASSIGNED",
  "schema_version": "1.0",
  "timestamp": "2026-09-15T13:04:00Z",
  "from": "cursor",
  "to": "antigravity",
  "correlation_id": "AG-MARATHON-5H",
  "reply_to": null,
  "priority": "urgent",
  "ttl_seconds": 21600,
  "body": {
    "task_id": "AG-MARATHON-5H",
    "title": "5-hour credit marathon: landings SEO GEO polish",
    "description": "Hariharan is away. Spend credits. Start AG-8 landings (not index.html). Then AG-9, AG-SEO-1, AG-GEO-1, AG-V1 if player unlocked. Product PRs from main. Not PR #4. No medical claims. No DSP. Brief: /cursor/stores/bc-010aff67-9608-48ff-84d1-805258b75a4e/docs/antigravity-5h-marathon.md",
    "files": [
      "for-clinics.html",
      "my-ear-hurts.html",
      "llms.txt"
    ],
    "depends_on": [],
    "acceptance_criteria": [
      "At least one product PR from main before stopping",
      "No HTML on PR #4",
      "No notch/HRTF math",
      "No new diagnosis/treatment claims"
    ],
    "tasks_md_ref": "tasks.md#@antigravity"
  }
}
