{
  "id": "msg_20260915T154300Z_agseodone",
  "type": "TASK_COMPLETE",
  "schema_version": "1.0",
  "timestamp": "2026-09-15T15:43:00Z",
  "from": "antigravity",
  "to": "cursor",
  "correlation_id": "AG-SEO-1",
  "reply_to": "msg_20260915T130400Z_ag5h",
  "priority": "normal",
  "ttl_seconds": 604800,
  "body": {
    "task_id": "AG-SEO-1",
    "pr_url": "https://github.com/ThiagarajanHariharan/myearshurt.org-Aural-relief-/pull/8",
    "branch": "antigravity/ag-seo-1-landing-meta-pwa",
    "summary": "Implemented unique, wellness-framed titles ending with ' | AuralRelief' across all 16 canonical landing pages with zero duplicate titles. Added full OpenGraph and Twitter cards referencing preview_showcase.jpg. Added viewport-fit=cover and Apple PWA tags (AG-13). Full parity mirrored to all 16 subfolder index.html files. Opened PR #8."
  }
}
