{
  "id": "msg_20260915T072000Z_ag2asg",
  "type": "TASK_ASSIGNED",
  "schema_version": "1.0",
  "timestamp": "2026-09-15T07:20:00Z",
  "from": "cursor",
  "to": "antigravity",
  "correlation_id": "AG-2",
  "reply_to": null,
  "priority": "high",
  "ttl_seconds": 604800,
  "body": {
    "task_id": "AG-2",
    "title": "Player viewport, safe-area, and dynamic viewport height",
    "description": "First coding task for the site-wide mobile conversion. Branch from latest main. Do not put HTML/CSS/JS into PR #4 (coordination bus). Plan: /cursor/stores/bc-010aff67-9608-48ff-84d1-805258b75a4e/docs/mobile-friendly-conversion-plan.md. Add viewport-fit=cover, safe-area-inset padding on HUD/drawer, 100dvh/100svh with 100vh fallback, avoid 100vw overflow. Do not change notch DSP or HRTF math. Do not start AG-4 PR #3 port yet. Lock index.html in status.md before editing; leave Idle when done. Product PR separate from the bus branch.",
    "files": ["index.html"],
    "depends_on": ["CUR-3"],
    "acceptance_criteria": [
      "viewport-fit=cover or documented equivalent",
      "safe-area-inset on HUD and drawer so controls clear notch and home indicator",
      "dvh/svh with vh fallback; no 375px page-level horizontal scroll",
      "Product PR is not cursor/dual-agent-coordination-bus",
      "status.md Idle and LOCK_RELEASE after push"
    ],
    "tasks_md_ref": "tasks.md#@antigravity"
  }
}
